{
  "accepted_oracle_commit": "0593c3df906d9493ac5c1da5c5e528f6078d275e",
  "capture_horizon_edges": 4096,
  "channels": [
    {
      "accepted": 1002,
      "attempts": 1002,
      "capture": {
        "byte_length": 16032,
        "path": "channel-0.bin",
        "sha256": "abbb344f5658bf7bbcf07e465f3e400b450aa521b3827540e1a067f3d57f8450"
      },
      "drained": 1002,
      "drop_counter_saturated": false,
      "dropped": 0,
      "marker_records": 2,
      "markers": {
        "byte_length": 32,
        "path": "markers-0.bin",
        "sha256": "ef2766159898293ccd3b20174fff9688b99de162971ecc26fa826543b5434918"
      },
      "overflowed": false,
      "payload": {
        "byte_length": 16000,
        "path": "payload-0.bin",
        "sha256": "3e9ba0da2d78a03333957fa3726423508c2c6e143bc48bc5bd674eb1d07dd7aa"
      },
      "payload_records": 1000,
      "role": "input"
    },
    {
      "accepted": 1002,
      "attempts": 1002,
      "capture": {
        "byte_length": 16032,
        "path": "channel-1.bin",
        "sha256": "9d6256dd0acb304ce64f5b6388cb3e231f0d275d4bc5b06936faf13dbbb7f32a"
      },
      "drained": 1002,
      "drop_counter_saturated": false,
      "dropped": 0,
      "marker_records": 2,
      "markers": {
        "byte_length": 32,
        "path": "markers-1.bin",
        "sha256": "ef2766159898293ccd3b20174fff9688b99de162971ecc26fa826543b5434918"
      },
      "overflowed": false,
      "payload": {
        "byte_length": 16000,
        "path": "payload-1.bin",
        "sha256": "8cd374ecbb3a93a13d5b341a2e2a48089aa9767483f926d322975eb73f2bf68b"
      },
      "payload_records": 1000,
      "role": "state"
    },
    {
      "accepted": 56,
      "attempts": 56,
      "capture": {
        "byte_length": 896,
        "path": "channel-2.bin",
        "sha256": "e0642d9b7226676c1caabdd8342a43000dd26b3ad6130fd7106a4f5c2b2eeb33"
      },
      "drained": 56,
      "drop_counter_saturated": false,
      "dropped": 0,
      "marker_records": 2,
      "markers": {
        "byte_length": 32,
        "path": "markers-2.bin",
        "sha256": "ef2766159898293ccd3b20174fff9688b99de162971ecc26fa826543b5434918"
      },
      "overflowed": false,
      "payload": {
        "byte_length": 864,
        "path": "payload-2.bin",
        "sha256": "b348e800435caa80ae04829142553dabd0542c1363ee6fbc4c2550f459f0a03f"
      },
      "payload_records": 54,
      "role": "service"
    }
  ],
  "clock_schedule_ref": {
    "byte_length": 746,
    "path": "clock-schedule.json",
    "sha256": "19151299f9de6e6c179cb2d08f5ff4f5ddf9e419373d8391372fc2e325441c56"
  },
  "completion": {
    "finalized": true,
    "observed_service_packets": 54,
    "observed_states": 1000,
    "pending_empty": true,
    "pipeline_quiescent": true,
    "raw_spikes": 54,
    "requested_steps": 1000,
    "service_valid_quiescent": true
  },
  "counter_bits": 64,
  "encoder_id_width": 1,
  "encoder_tail_edges": 4,
  "encoder_timestamp_bits": 16,
  "epoch": 0,
  "event_codes": {
    "alignment_marker": 17,
    "encoder_packet_serviced": 16,
    "input_step_applied": 14,
    "state_and_raw_spike_observed": 15
  },
  "evidence_class": "simulated-timing",
  "fifo_capacity_records": 1024,
  "input_trace": {
    "byte_length": 22165,
    "path": "input.txt",
    "sha256": "e35a8fd0969e2b26d3556b7912acd1c330212e0aa40ff05053aafc6e771ef795"
  },
  "native_source_cohort": "sc-neurocore-neural-step-1n1b16t.v1",
  "numerical_projection": {
    "byte_length": 5212,
    "path": "observed-projection.txt",
    "sha256": "c405de711cdbf8fae3a0c668ecfa643e7a6e460bad60c05b5bd0bfca208a3dd2"
  },
  "numerical_trace": {
    "byte_length": 15044,
    "path": "numerical.txt",
    "sha256": "5bf1e20752dd9061c349f6e1bc9c7df656ac51407b665e7366d22a78a4a3d041"
  },
  "profile": "neural-step-capture",
  "reference_projection": {
    "byte_length": 5212,
    "path": "results_expected.txt",
    "sha256": "c405de711cdbf8fae3a0c668ecfa643e7a6e460bad60c05b5bd0bfca208a3dd2"
  },
  "run_id": "selected-source-positive-original",
  "sc_body_pins": {
    "hdl/sc_aer_encoder.v": "0b2ab4c58f7d889c1f33973562dcde7e213515849d59bc2e1a35d019210cf959",
    "hdl/sc_lif_neuron.v": "68e99ce4b0de732cd2f48b4545a0f6f2b16a5d341eeb0ea8d2867c4c45e6e1ff",
    "hdl/tb_sc_lif_neuron.v": "999c2e0c65d7a3b72ddda71984a38870eaf8a2afdaa81d611c8fd1962d1519ab",
    "scripts/cosim_gen_and_check.py": "7acfe1ff9d69b5138f323c064733d928b7a67c54a52ef334539c4a2921a803c0",
    "src/sc_neurocore/constants.py": "57598c74eab8baca33da7c228a2b2db4d03ce462b9f1640810c9d29959f5ecbc",
    "src/sc_neurocore/neurons/fixed_point_lif.py": "ee7a4da29078537ca6356cf9098b8c628de805b3a63dfa3c74eba91ac642a623",
    "tests/test_cosim_gen_and_check.py": "89f77674991e4b60461237fa43bf79eae4757d9b8ef826fa05c7e249ca5da51d"
  },
  "schema_id": "loop-timing-witness.neural-step-run.v1",
  "service_trace": {
    "byte_length": 790,
    "path": "service.txt",
    "sha256": "c57a19bca3ff1225f8f0545a27354e55f7cecba45feebfe429610fbba13b9e76"
  },
  "source_contract_ref": {
    "byte_length": 17704,
    "path": "source-contract.json",
    "sha256": "ec1236a69fc9e16a4eff1dfa7bdad8aa8b6088fc4ebceb8d8c43d33517199304"
  },
  "source_files": [
    {
      "byte_length": 4060,
      "path": "native/capture_receipts.h",
      "sha256": "43970e8588641dcc71e4b85ae8be3e79b6a9c8ace0495eb24f4cf19e731975e6"
    },
    {
      "byte_length": 2736,
      "path": "native/channel_output.h",
      "sha256": "9c44cae639f248afde856ecbf70581dda7708d1828c0e3d845351185f956de8b"
    },
    {
      "byte_length": 7780,
      "path": "native/native_trial.cpp",
      "sha256": "0cdeaceedc2e3a42c7d5822409cffbba4679d37f655ee2210511913ca103e75c"
    },
    {
      "byte_length": 3518,
      "path": "native/neural_simulation.h",
      "sha256": "5cbab75dc65771ec489db3879af33555cda874525a90a2cf033bce9de657ca41"
    },
    {
      "byte_length": 4604,
      "path": "native/reset_receipt.h",
      "sha256": "f5ae4df5eb049751e9c518d7b742155b5ccb3dd323055bb11495fc9314f8e9ac"
    },
    {
      "byte_length": 6116,
      "path": "native/source_trace_output.h",
      "sha256": "25af4203af1c3157ef2893c941715680ce67e6892323ff21b12666f862cc6c31"
    },
    {
      "byte_length": 2620,
      "path": "native/stimulus_rows.h",
      "sha256": "4ff2da75625d01160184c8d0ffa372cefa39e89693cb3852e710d0b15cdb0e81"
    },
    {
      "byte_length": 3203,
      "path": "native_neural_dut.sv",
      "sha256": "c62245bf71f89519718d2deb1d98aee1353817b10f6f93714894067b4adb9858"
    },
    {
      "byte_length": 919,
      "path": "source/LOOP-TIMING-WITNESS/rtl/clock_reset_release.sv",
      "sha256": "3e3d87b113486c684b35bada2d04ca5bc1e551a1adfe8615da8e279f8086fb4c"
    },
    {
      "byte_length": 3950,
      "path": "source/LOOP-TIMING-WITNESS/rtl/event_record_fifo.sv",
      "sha256": "bb6a1ced8cec4328c7b9d765b082cf8eab604561b9f1f8e0ca800ebd6949ea26"
    },
    {
      "byte_length": 5282,
      "path": "source/LOOP-TIMING-WITNESS/rtl/shared_event_witness.sv",
      "sha256": "1b80a54c3262b2f53ce4c24d3a4b1e19ecaa2d76b43fce55432b911bdc4ad53a"
    },
    {
      "byte_length": 2181,
      "path": "source/LOOP-TIMING-WITNESS/runtime/exclusive_output.h",
      "sha256": "0e8dde43e685e82960b2e15781d2b80ded4594fb867a17fda3572e775a5f904b"
    },
    {
      "byte_length": 972,
      "path": "source/LOOP-TIMING-WITNESS/runtime/refusal.h",
      "sha256": "08a3d5b8d1ca79a4043afc20a1cc4d338569ca21cb314d4b06be449b181a9515"
    },
    {
      "byte_length": 3282,
      "path": "source/SC-NEUROCORE/hdl/sc_aer_encoder.v",
      "sha256": "0b2ab4c58f7d889c1f33973562dcde7e213515849d59bc2e1a35d019210cf959"
    },
    {
      "byte_length": 4424,
      "path": "source/SC-NEUROCORE/hdl/sc_lif_neuron.v",
      "sha256": "68e99ce4b0de732cd2f48b4545a0f6f2b16a5d341eeb0ea8d2867c4c45e6e1ff"
    },
    {
      "byte_length": 3830,
      "path": "source/SC-NEUROCORE/hdl/tb_sc_lif_neuron.v",
      "sha256": "999c2e0c65d7a3b72ddda71984a38870eaf8a2afdaa81d611c8fd1962d1519ab"
    },
    {
      "byte_length": 8536,
      "path": "source/SC-NEUROCORE/scripts/cosim_gen_and_check.py",
      "sha256": "7acfe1ff9d69b5138f323c064733d928b7a67c54a52ef334539c4a2921a803c0"
    },
    {
      "byte_length": 7180,
      "path": "source/SC-NEUROCORE/src/sc_neurocore/__init__.py",
      "sha256": "a1bff2b31a396a968a07abc797f9f16b5f67190d1a73679b4bc6c0de3fe755d4"
    },
    {
      "byte_length": 5570,
      "path": "source/SC-NEUROCORE/src/sc_neurocore/constants.py",
      "sha256": "57598c74eab8baca33da7c228a2b2db4d03ce462b9f1640810c9d29959f5ecbc"
    },
    {
      "byte_length": 4147,
      "path": "source/SC-NEUROCORE/src/sc_neurocore/exceptions.py",
      "sha256": "f9cdede6a8d79192f68c808ccb297f6552a2db719a3c74bace9c8c40aefb56bc"
    },
    {
      "byte_length": 7397,
      "path": "source/SC-NEUROCORE/src/sc_neurocore/neurons/__init__.py",
      "sha256": "a27b960e16776ce16f9bd70d9441a92cb808bdcffc3ebb5df32018b0e7b66598"
    },
    {
      "byte_length": 4492,
      "path": "source/SC-NEUROCORE/src/sc_neurocore/neurons/_stochastic_threshold.py",
      "sha256": "e8197e9fb1a2127c9c1bd18c9b2bee902d6dcf3bd85c06dcdd56358d43f3475a"
    },
    {
      "byte_length": 8068,
      "path": "source/SC-NEUROCORE/src/sc_neurocore/neurons/_units.py",
      "sha256": "096035d8c6c73c56cb4e3bc250e3be949e657e0aa0d58aec07a5a6979d503390"
    },
    {
      "byte_length": 1143,
      "path": "source/SC-NEUROCORE/src/sc_neurocore/neurons/base.py",
      "sha256": "0cb339b37aaf52c3eb66b44ad186d432d76326c3ead5ef99bb9276bda22557b3"
    },
    {
      "byte_length": 1461,
      "path": "source/SC-NEUROCORE/src/sc_neurocore/neurons/dendritic.py",
      "sha256": "0599007b6f7ba07b7e247458d017204e0a67d65fea51733b27a7d59ba3dacaf0"
    },
    {
      "byte_length": 33085,
      "path": "source/SC-NEUROCORE/src/sc_neurocore/neurons/equation_builder.py",
      "sha256": "1ca25a5aa0d14e036b6baf0e282f92973492edc9be63399cdad122c033b1a5a9"
    },
    {